{
  "event_type": "TRIPS.Record",
  "timestamp": "2025-09-03T00:10:00Z",
  "program": "BWB-Q100",
  "domain": "SYS",
  "version": "v1.4",
  "producer": "TRIPS.RecordService",
  "payload": {
    "snapshot_id": "v1.4",
    "context": "Gamma configuration finalized",
    "det_hash": "0x3488cc8cacea9a714c04e1f6e4c9c631d8d200b21ce282333014c45b55eb03ee",
    "qaudit_signature": "PQC-Dilithium3-75c3f7043df999bb",
    "system_state": {
      "cad_models": {
        "count": 147,
        "size_gb": 2.3
      },
      "cae_results": {
        "count": 89,
        "size_gb": 1.8
      },
      "requirements": {
        "count": 234,
        "traced": 234
      },
      "quantum_metrics": {
        "confidence": 0.79,
        "cvar": 0.10
      }
    }
  },
  "det_ref": "DET:TRIPS:SYS:snapshot:V1.4",
  "trace_refs": [
    "REQ:BWB-Q100-SYS-CONFIG-001",
    "TRACE:GAMMA-CONFIG-BASELINE"
  ],
  "signature": "0xa1b2c3d4e5f6789a0b1c2d3e4f567890a1b2c3d4e5f6789a0b1c2d3e4f567890"
}