{
  "event_type": "TRIPS.Track",
  "timestamp": "2025-09-03T00:00:00Z",
  "program": "BWB-Q100",
  "domain": "AAA",
  "version": "v1.0",
  "producer": "TRIPS.TrackService",
  "payload": {
    "monitored_changes": [
      {
        "change_type": "CAD",
        "component": "AAA-CAD-Component",
        "timestamp": "2025-09-03T00:00:00Z",
        "description": "Multi-bubble topology modified (10→12 vessels)",
        "magnitude": 3.5
      },
      {
        "change_type": "CAE",
        "component": "AAA-CAE-Component",
        "timestamp": "2025-09-03T00:00:01Z",
        "description": "Re-meshing triggered (847k elements)",
        "magnitude": 2.8
      },
      {
        "change_type": "Requirements",
        "component": "AAA-Requirements-Component",
        "timestamp": "2025-09-03T00:00:02Z",
        "description": "Fatigue life updated (195k→212k cycles)",
        "magnitude": 4.2
      }
    ],
    "real_time": true,
    "domain": "AAA",
    "monitor_types": ["CAD", "CAE", "CAT", "Requirements", "Quantum", "SupplyChain"]
  },
  "det_ref": "DET:TRIPS:AAA:monitoring:V1.0",
  "trace_refs": [
    "REQ:BWB-Q100-AAA-001",
    "TRACE:AAA-CAD-MAPPING-001"
  ],
  "signature": "0x7f3e8a9b1c2d5e4f6a0b8c9d2e1f4a5b7c8d9e0f1a2b3c4d5e6f7a8b9c0d1e2f"
}